{
  "asset": {
    "asset_id": "course_v1:train:928.jpg",
    "relative_path": "train/928.jpg",
    "sha256": "8d1a7a26478b7bcb5e031e9a8e46a74889610d2e142a38d04f3b6eb6d774902f",
    "split": "train"
  },
  "canonical_sha256": "0434d1e073cf5813905a31c74c3a17ff7db64f23b16fe91df9e3a475a115a552",
  "canonical_status": "active_candidate",
  "display": {
    "micro_tags": [
      "黄昏",
      "电线",
      "绿植",
      "天空"
    ],
    "short_description": "傍晚时分，天空泛着淡蓝与橙色光晕，纵横交错的电线横跨画面，下方是茂密的绿色灌木丛与远处山峦轮廓。",
    "theme": "黄昏电线与绿植"
  },
  "evidence": {
    "cautious_inferences": [
      "光线来自地平线方向，表明时间接近黄昏。"
    ],
    "direct_observations": [
      "天空呈现从蓝色到淡橙色的渐变，有稀疏云层。",
      "多条黑色电线在空中交叉延伸，部分线上有鸟影。"
    ],
    "uncertainties": []
  },
  "facts": {
    "actions": [],
    "attributes": [
      "天空呈淡蓝色并带橙色霞光",
      "电线密集交错",
      "植被茂盛",
      "建筑物部分被遮挡"
    ],
    "relations": [
      "电线横跨天空。",
      "树木位于前景与中景。",
      "建筑物在树木后方。"
    ],
    "scene": "户外乡村或郊区街道旁",
    "subjects": [
      "电线",
      "树木",
      "建筑物",
      "天空",
      "手"
    ],
    "visual_medium": "photograph"
  },
  "fallback": {
    "caption_composer": "phase6_0b_safe_facts_caption_composer_v1",
    "do_not_assert": [
      "光线来自地平线方向，表明时间接近黄昏。"
    ],
    "must_not_override_valid_model_output": true,
    "policy": "use_only_when_public_model_body_invalid",
    "safe_caption": "天空呈现从蓝色到淡橙色的渐变，有稀疏云层；多条黑色电线在空中交叉延伸，部分线上有鸟影。",
    "safe_facts": [
      "天空呈现从蓝色到淡橙色的渐变，有稀疏云层。",
      "多条黑色电线在空中交叉延伸，部分线上有鸟影。"
    ]
  },
  "label_id": "cpl_e31972dc3f8ecfbf40552d26",
  "provenance": {
    "generated_at": "2026-08-03T12:52:29.200470+00:00",
    "migrated_at": "2026-08-03T12:52:29.203610+00:00",
    "migration_version": "phase6_0b_canonical_safety_migration_v1",
    "model": "Qwen/Qwen3-VL-4B-Instruct",
    "model_revision": "ebb281ec70b05090aa6165b016eac8ec08e71b17",
    "normalizer": "phase6_0a_lossless_normalizer_v1",
    "prompt_id": "phase6_0a_canonical_pseudo_label_v1",
    "prompt_sha256": "d902aea11cdae8c151445c308bffc5075e12ff12977773221f92454ca727d111",
    "raw_output_sha256": "915e49fbddcb5d09d6e872af6d5d96a8f9b76f91e1f73900ce0d07c1419fc1fe",
    "recovered_at_tokens": null,
    "source_label_id": "cpl_6588d1593e987ac2dfc47c7a",
    "source_run_id": "run_20260803_full_v2_1_1",
    "source_schema_version": "scenemindx_canonical_pseudo_label_v2_candidate",
    "split_compatibility_migrated_at": "2026-08-03T12:52:29.203972+00:00",
    "split_compatibility_migration_version": "phase6_1_split_compatibility_migration_v1",
    "split_compatibility_validator": "phase6_1_split_compatibility_validator_v1",
    "validator": "phase6_0b_canonical_safety_validator_v1"
  },
  "quality": {
    "needs_review": false,
    "sanitization_actions": [],
    "sanitization_applied": false,
    "schema_valid": true,
    "semantic_status": "warning",
    "validation_errors": [],
    "warning_codes": [
      "migrated_from_phase6_0a",
      "punctuation_normalized",
      "safe_caption_rebuilt",
      "safe_facts_rebuilt"
    ]
  },
  "review": {
    "automatic_validation": {
      "status": "warning"
    },
    "codex_visual_review": {
      "notes": [],
      "status": "not_reviewed"
    },
    "gold_status": false,
    "review_label": "machine_provisional",
    "user_human_review": {
      "status": "pending"
    }
  },
  "schema_version": "scenemindx_canonical_pseudo_label_v2_1_1_candidate",
  "supersedes": [
    "cpl_6588d1593e987ac2dfc47c7a"
  ],
  "text_evidence": {
    "candidate_text": [],
    "confidence": null,
    "ocr_candidates": [],
    "presence": "none",
    "verification_status": "none",
    "verified_text": [],
    "verified_text_source": "not_available",
    "visual_candidates": []
  }
}
