{
  "asset": {
    "asset_id": "course_v1:train:1772.jpg",
    "relative_path": "train/1772.jpg",
    "sha256": "6388f4934a288ceb302520ce051283c8cafa95ef773e6b50f4e242bca0c0a017",
    "split": "train"
  },
  "canonical_sha256": "7489004ee9a66ec61f4e1dbf101ac063518c3ca2d6cd324dfd081224c60373eb",
  "canonical_status": "active_candidate",
  "display": {
    "micro_tags": [
      "小花",
      "泥土",
      "绿叶",
      "野花"
    ],
    "short_description": "两朵淡紫色小花在干裂的泥土中绽放，周围有绿叶和碎土块。",
    "theme": "泥土中的小花"
  },
  "evidence": {
    "cautious_inferences": [],
    "direct_observations": [
      "画面中有两朵淡紫色的小花，中心为黄色花蕊。",
      "花朵周围有绿色叶片，背景为干裂的棕色泥土。"
    ],
    "uncertainties": []
  },
  "facts": {
    "actions": [],
    "attributes": [
      "淡紫色花瓣",
      "黄色花心",
      "绿色叶片",
      "干裂土壤"
    ],
    "relations": [
      "花朵生长于泥土中。",
      "叶片围绕花朵分布。"
    ],
    "scene": "干裂土壤中的植物生长环境",
    "subjects": [
      "两朵淡紫色小花",
      "绿色叶片",
      "干裂泥土"
    ],
    "visual_medium": "photograph"
  },
  "fallback": {
    "caption_composer": "phase6_0b_safe_facts_caption_composer_v1",
    "do_not_assert": [],
    "must_not_override_valid_model_output": true,
    "policy": "use_only_when_public_model_body_invalid",
    "safe_caption": "画面中有两朵淡紫色的小花，中心为黄色花蕊；花朵周围有绿色叶片，背景为干裂的棕色泥土。",
    "safe_facts": [
      "画面中有两朵淡紫色的小花，中心为黄色花蕊。",
      "花朵周围有绿色叶片，背景为干裂的棕色泥土。"
    ]
  },
  "label_id": "cpl_ac352c766b8b33c70237f135",
  "provenance": {
    "generated_at": "2026-08-03T15:05:18.665496+00:00",
    "migrated_at": "2026-08-03T15:05:18.666999+00:00",
    "migration_version": "phase6_0b_canonical_safety_migration_v1",
    "model": "Qwen/Qwen3-VL-4B-Instruct",
    "model_revision": "ebb281ec70b05090aa6165b016eac8ec08e71b17",
    "normalizer": "phase6_0a_lossless_normalizer_v1",
    "prompt_id": "phase6_0a_canonical_pseudo_label_v1",
    "prompt_sha256": "d902aea11cdae8c151445c308bffc5075e12ff12977773221f92454ca727d111",
    "raw_output_sha256": "7d0a35e52851f9f2d0ef54ac37836140590b0f992ae27267ad532751d57660c4",
    "recovered_at_tokens": null,
    "source_label_id": "cpl_718bfd2b2c62049edbabe07c",
    "source_run_id": "run_20260803_full_v2_1_1",
    "source_schema_version": "scenemindx_canonical_pseudo_label_v2_candidate",
    "split_compatibility_migrated_at": "2026-08-03T15:05:18.667208+00:00",
    "split_compatibility_migration_version": "phase6_1_split_compatibility_migration_v1",
    "split_compatibility_validator": "phase6_1_split_compatibility_validator_v1",
    "validator": "phase6_0b_canonical_safety_validator_v1"
  },
  "quality": {
    "needs_review": false,
    "sanitization_actions": [],
    "sanitization_applied": false,
    "schema_valid": true,
    "semantic_status": "warning",
    "validation_errors": [],
    "warning_codes": [
      "migrated_from_phase6_0a",
      "punctuation_normalized",
      "safe_caption_rebuilt",
      "safe_facts_rebuilt"
    ]
  },
  "review": {
    "automatic_validation": {
      "status": "warning"
    },
    "codex_visual_review": {
      "notes": [],
      "status": "not_reviewed"
    },
    "gold_status": false,
    "review_label": "machine_provisional",
    "user_human_review": {
      "status": "pending"
    }
  },
  "schema_version": "scenemindx_canonical_pseudo_label_v2_1_1_candidate",
  "supersedes": [
    "cpl_718bfd2b2c62049edbabe07c"
  ],
  "text_evidence": {
    "candidate_text": [],
    "confidence": null,
    "ocr_candidates": [],
    "presence": "none",
    "verification_status": "none",
    "verified_text": [],
    "verified_text_source": "not_available",
    "visual_candidates": []
  }
}
